{
  "analyst_guidance": [
    "Treat returned stage records as observed evidence only.",
    "The ordered joins form an investigative hypothesis, not causal or attribution proof.",
    "Record supporting, conflicting, and missing evidence before escalation.",
    "A separate detection-engineering review is required before operational rule conversion."
  ],
  "attck_mappings": [
    {
      "id": "T1213.002",
      "name": "Sharepoint",
      "rationale": "Cloud-file enumeration or download may support SharePoint data-source collection review.",
      "version": "18"
    }
  ],
  "authorized_use": "defensive_only",
  "confounders": [
    "sync clients",
    "backup",
    "eDiscovery",
    "service accounts",
    "bulk collaboration"
  ],
  "defensive_objective": "Surface collection-like activity without treating sync, backup, eDiscovery, or collaboration as malicious by default.",
  "disconfirming_evidence": [
    "Device principal differs",
    "Activity volume is consistent with approved sync",
    "No session-to-device relationship can be established"
  ],
  "entities": [
    {
      "class": "account",
      "collision_risk": "names and mutable representations can collide across tenants or time; require scoped immutable identifiers",
      "identifier": "immutable identifier emitted by the applicable stage extractor",
      "normalization": "tostring without case folding; preserve the original source value"
    },
    {
      "class": "cloud_file",
      "collision_risk": "names and mutable representations can collide across tenants or time; require scoped immutable identifiers",
      "identifier": "immutable identifier emitted by the applicable stage extractor",
      "normalization": "tostring without case folding; preserve the original source value"
    },
    {
      "class": "device",
      "collision_risk": "names and mutable representations can collide across tenants or time; require scoped immutable identifiers",
      "identifier": "immutable identifier emitted by the applicable stage extractor",
      "normalization": "tostring without case folding; preserve the original source value"
    },
    {
      "class": "network_destination",
      "collision_risk": "names and mutable representations can collide across tenants or time; require scoped immutable identifiers",
      "identifier": "immutable identifier emitted by the applicable stage extractor",
      "normalization": "tostring without case folding; preserve the original source value"
    }
  ],
  "expected_evidence": [
    "cloud file activity",
    "authenticated account session",
    "device network context"
  ],
  "hypothesis": "A principal performs bulk cloud-file activity after authentication and has related device network evidence within a bounded interval.",
  "id": "H08",
  "joins": [
    {
      "cardinality": "bounded_many_to_many_requires_fanout_review",
      "collision_risk": "same textual value may identify different entities across tenant, workspace, reuse, rename, NAT, or proxy contexts",
      "from": "S01",
      "key": "Join1",
      "time_window": "correlation_window",
      "to": "S02",
      "type": "inner"
    },
    {
      "cardinality": "bounded_many_to_many_requires_fanout_review",
      "collision_risk": "same textual value may identify different entities across tenant, workspace, reuse, rename, NAT, or proxy contexts",
      "from": "S02",
      "key": "Join2",
      "time_window": "correlation_window",
      "to": "S03",
      "type": "inner"
    }
  ],
  "offline_assurance_disclaimer": "Offline qualification leaves Microsoft Sentinel tenant behavior, operational efficacy, cost, latency, precision, recall, and false-positive performance unverified.",
  "parameters": [
    {
      "name": "start_time",
      "required": true,
      "type": "utc_timestamp"
    },
    {
      "name": "end_time",
      "required": true,
      "type": "utc_timestamp"
    },
    {
      "name": "workspace_id",
      "required": true,
      "type": "workspace_identifier"
    },
    {
      "name": "tenant_id",
      "required": true,
      "type": "tenant_identifier"
    },
    {
      "default": "2h",
      "name": "correlation_window",
      "required": false,
      "type": "duration"
    }
  ],
  "provenance": {
    "as_of": "2026-09-17",
    "license_review": "pending_human_review",
    "query_authorship": "Original query authored for Sentinel Hunt Workbench; not copied from vendor sample queries.",
    "schema_basis": "Microsoft Azure Monitor table references listed in references."
  },
  "qualification_state": "draft",
  "queries": {
    "sentinel_analytics": {
      "content": "// Generated original query: Sentinel Hunt Workbench\n// huntwb:time-scope\n// huntwb:tenant-scope\n// huntwb:workspace-scope\n// huntwb:order=ascending\n// huntwb:join-key=typed\n// huntwb:entity-discriminator=immutable\n// huntwb:dedup\n// huntwb:aggregate-after-correlation\n// huntwb:typed-identifiers\n// huntwb:correlation-window=bounded\n// huntwb:validity-check\n// huntwb:missing-is-unknown\n// huntwb:language=correlation\nlet start_time = {{start_time}};\nlet end_time = {{end_time}};\nlet workspace_id = {{workspace_id}};\nlet tenant_id = {{tenant_id}};\nlet correlation_window = {{correlation_window}};\nlet Stage1 = workspace(workspace_id).OfficeActivity\n| where TimeGenerated between (start_time .. end_time)\n| where isnotempty(OfficeObjectId)\n| project Stage1Time=todatetime(TimeGenerated), WorkspaceScope=workspace_id, TenantScope=tenant_id, Stage1EntityId=tostring(OfficeObjectId), Stage1EventId=strcat_array(pack_array(tostring(Id)), \"|\"), Stage1EvidenceType=\"cloud file activity\", Join1=tostring(UserId)\n| where isnotempty(Stage1EntityId) and isnotempty(Stage1EventId)\n| summarize arg_min(Stage1Time, *) by Stage1EventId;\nlet Stage1Rows = toscalar(Stage1 | count);\nlet Stage2 = workspace(workspace_id).SigninLogs\n| where TimeGenerated between (start_time .. end_time)\n| where tostring(AADTenantId) == tostring(tenant_id)\n| where ResultType == \"0\"\n| project Stage2Time=todatetime(TimeGenerated), WorkspaceScope=workspace_id, TenantScope=tenant_id, Stage2EntityId=tostring(UserId), Stage2EventId=strcat_array(pack_array(tostring(Id)), \"|\"), Stage2EvidenceType=\"authenticated account session\", Join1=tostring(UserPrincipalName), Join2=tostring(UserPrincipalName)\n| where isnotempty(Stage2EntityId) and isnotempty(Stage2EventId)\n| summarize arg_min(Stage2Time, *) by Stage2EventId;\nlet Stage2Rows = toscalar(Stage2 | count);\nlet Stage3 = workspace(workspace_id).DeviceNetworkEvents\n| where TimeGenerated between (start_time .. end_time)\n| where isnotempty(DeviceId)\n| project Stage3Time=todatetime(TimeGenerated), WorkspaceScope=workspace_id, TenantScope=tenant_id, Stage3EntityId=tostring(DeviceId), Stage3EventId=strcat_array(pack_array(tostring(DeviceId), tostring(ReportId), tostring(TimeGenerated)), \"|\"), Stage3EvidenceType=\"device network context\", Join2=tostring(InitiatingProcessAccountUpn)\n| where isnotempty(Stage3EntityId) and isnotempty(Stage3EventId)\n| summarize arg_min(Stage3Time, *) by Stage3EventId;\nlet Stage3Rows = toscalar(Stage3 | count);\nStage1\n| join kind=inner Stage2 on WorkspaceScope, TenantScope, Join1\n| where Stage2Time between (Stage1Time .. Stage1Time + correlation_window)\n| join kind=inner Stage3 on WorkspaceScope, TenantScope, Join2\n| where Stage3Time between (Stage2Time .. Stage2Time + correlation_window)\n| project Stage1Time, Stage1EntityId, Stage1EventId, Stage1EvidenceType, Stage1Rows, Stage2Time, Stage2EntityId, Stage2EventId, Stage2EvidenceType, Stage2Rows, Stage3Time, Stage3EntityId, Stage3EventId, Stage3EvidenceType, Stage3Rows, WorkspaceScope, TenantScope, EvidenceCompleteness=\"all required synthetic stages present\", CorrelationStatement=\"correlated evidence; not proof of causation or compromise\"\n| order by Stage1Time asc\n",
      "kind": "correlation",
      "language": "KQL",
      "offline_assurance": "schema and static checks only until fixture execution is recorded",
      "stage_contract": [
        "S01",
        "S02",
        "S03"
      ]
    }
  },
  "references": [
    {
      "kind": "authoritative",
      "title": "MITRE ATT&CK Analytics",
      "url": "https://attack.mitre.org/analytics/"
    },
    {
      "kind": "authoritative",
      "title": "MITRE ATT&CK October 2025 updates",
      "url": "https://attack.mitre.org/resources/updates/updates-october-2025/"
    },
    {
      "kind": "authoritative",
      "title": "NIST SP 800-61 Rev. 3",
      "url": "https://csrc.nist.gov/pubs/sp/800/61/r3/final"
    },
    {
      "kind": "authoritative",
      "title": "Microsoft schema reference: devicenetworkevents",
      "url": "https://learn.microsoft.com/en-us/azure/azure-monitor/reference/tables/devicenetworkevents"
    },
    {
      "kind": "authoritative",
      "title": "Microsoft schema reference: officeactivity",
      "url": "https://learn.microsoft.com/en-us/azure/azure-monitor/reference/tables/officeactivity"
    },
    {
      "kind": "authoritative",
      "title": "Microsoft schema reference: signinlogs",
      "url": "https://learn.microsoft.com/en-us/azure/azure-monitor/reference/tables/signinlogs"
    },
    {
      "kind": "authoritative",
      "title": "Hunt for threats with Microsoft Sentinel",
      "url": "https://learn.microsoft.com/en-us/azure/sentinel/hunting"
    },
    {
      "kind": "vendor_framework",
      "title": "Splunk PEAK Threat Hunting Framework",
      "url": "https://www.splunk.com/en_us/blog/security/peak-threat-hunting-framework.html"
    }
  ],
  "stages": [
    {
      "entity_extractors": {
        "cloud_file": "tostring(OfficeObjectId)"
      },
      "event_id_fields": [
        "Id"
      ],
      "event_time": "TimeGenerated",
      "evidence_output": [
        "cloud file activity"
      ],
      "id": "S01",
      "join_in": null,
      "join_out": "tostring(UserId)",
      "order": 1,
      "required_fields": [
        "UserId",